"",ResponseId,condition,open.1,open.2,ColumnID,Text,Segment,WC,Affect,emotion
655,R_6lPJphM0Hs9A92N,Low,I guess the images are about conservation and people joining together to protest and make a positive influence on changing the environment.,I am confused because I don't understand some images and I see no cohesion of the images that are shown.,text,I guess the images are about conservation and people joining together to protest and make a positive influence on changing the environment. I am confused because I don't understand some images and I see no cohesion of the images that are shown.,1,42,9.52,2.38
656,R_6npBBgSc0N8FMy6,High,We are making the planet a warmer place with our manmade pollution and the way we live. It makes  me angry and sad to see us destroying our home,It is showing the effect of climate change on the planet. It makes me feel very sad for all of the animals we are killing,text,We are making the planet a warmer place with our manmade pollution and the way we live. It makes  me angry and sad to see us destroying our home It is showing the effect of climate change on the planet. It makes me feel very sad for all of the animals we are killing,1,54,9.26,5.56
657,R_6fvgSlyqluXTnPd,Low,It makes me realize that climate change needs to continue to be addressed and we need to gather as much info as possible,I don't understand the language but I can see how climate change is affecting animals and the environment,text,It makes me realize that climate change needs to continue to be addressed and we need to gather as much info as possible  I don't understand the language but I can see how climate change is affecting animals and the environment,1,41,0,0
658,R_6EFxf1A9SAUwFWo,Low,They look like pictures of the news shows. I don’t watch the news it’d too depressing and sad.  Nothing but negative stories.,Pictures of the outdoors and make me feel happy and excited about spring and summer time . My kids love outside,text,They look like pictures of the news shows. I don’t watch the news it’d too depressing and sad.  Nothing but negative stories.  Pictures of the outdoors and make me feel happy and excited about spring and summer time . My kids love outside,1,42,14.29,11.9
659,R_7dtXdvu3bq4Li02,Low,"Neutral. You mentioned climate earlier, but I cannot subconsciously make a connection, as it seems foreign and some good.","Worldwide, the temperature is rising and that poor polar bear is gonna soon be extinct. This is worldwide, not just USA",text,"Neutral. You mentioned climate earlier, but I cannot subconsciously make a connection, as it seems foreign and some good. Worldwide, the temperature is rising and that poor polar bear is gonna soon be extinct. This is worldwide, not just USA",1,40,5,2.5
660,R_11bzBwHkCwVTqjY,Low,This is making me look like they are showing different areas of a city and showing that many different aspects of what goes on in it like the land maybe protests Maybe security groups,I believe I'm seeing like the maps and graphs of a certain area that is cold because I see a polar bear on a piece of ice so I'm believing that they are maybe measuring or conducting some type of research in a very cold climate,text,This is making me look like they are showing different areas of a city and showing that many different aspects of what goes on in it like the land maybe protests Maybe security groups I believe I'm seeing like the maps and graphs of a certain area that is cold because I see a polar bear on a piece of ice so I'm believing that they are maybe measuring or conducting some type of research in a very cold climate,1,80,0,0
661,R_60rbod8fKVxw5pF,High,It looks like an Artificial Intelligence generated images of the effects of global warning.  The images are quite striking and disturbing at the same time.,The content of these images appear to be related to global warming and its effects on different parts of the world.  It makes me sad and alarmed.,text,It looks like an Artificial Intelligence generated images of the effects of global warning.  The images are quite striking and disturbing at the same time. The content of these images appear to be related to global warming and its effects on different parts of the world.  It makes me sad and alarmed.,1,52,7.69,3.85
662,R_7OiaB7q1Et2dBpa,Low,"The pictures seem to be random pictures of people, places things.  People in different scenes a couple group pictures nice places and not so nice places.  The pictures got me thinking of many thoughts for example are these pictures linked to each other or what the might or might not  have in common.  The pictures did not trigger any different emotions so made me feel content","The pictures seemed more intense, like more educated or the weather and graphs to report what is going on around the earth. I did not understand some of the other languages on a couple of the pictures. So it seemed that the pictures had more in common with each other but made me feel a little uneasy",text,"The pictures seem to be random pictures of people, places things.  People in different scenes a couple group pictures nice places and not so nice places.  The pictures got me thinking of many thoughts for example are these pictures linked to each other or what the might or might not  have in common.  The pictures did not trigger any different emotions so made me feel content  The pictures seemed more intense, like more educated or the weather and graphs to report what is going on around the earth. I did not understand some of the other languages on a couple of the pictures. So it seemed that the pictures had more in common with each other but made me feel a little uneasy",1,123,3.25,1.63
663,R_3QnrroDbFrdid0K,High,These are scenes in nature  some are scary and some are breathtaking.  I think they are meant to show some images of climate change.,"Some of these images are truly breath taking.  I shows the amazing world we leave in, good and bad. The pictures also indicate that the worlds destiny is in our hands.",text,"These are scenes in nature  some are scary and some are breathtaking.  I think they are meant to show some images of climate change. Some of these images are truly breath taking.  I shows the amazing world we leave in, good and bad. The pictures also indicate that the worlds destiny is in our hands.",1,55,12.73,12.73
664,R_3Pqjw6B47ABcs8D,High,These images make me feel like the planet is doomed to an arid and fiery future. The images are disturbing and depressing,"The content of these images is sad and depressing, horrifying and frustrating. They make me sort of glad that I'll probably be dead before the worst happens",text,"These images make me feel like the planet is doomed to an arid and fiery future. The images are disturbing and depressing The content of these images is sad and depressing, horrifying and frustrating. They make me sort of glad that I'll probably be dead before the worst happens",1,49,20.41,12.24
665,R_1Ed7b3o4Ckej7uM,Low,"These are just google images, they don't make me feel anything because they are not relevant. If they included some context it would be more interesting.","Google images pertaining to the earth or nature. They are not relevant to me, so they don't make me feel anything",text,"These are just google images, they don't make me feel anything because they are not relevant. If they included some context it would be more interesting. Google images pertaining to the earth or nature. They are not relevant to me, so they don't make me feel anything",1,47,2.13,0
666,R_6SI8KRY6PCC5pRA,Low,I t would be a mixture of feelings. I’m not really sure what they represent. I do the like one with the hand and the world,Polar bear my favorite.the others are too many charts to concentrate on. The global temp chart is easy to follow.,text,I t would be a mixture of feelings. I’m not really sure what they represent. I do the like one with the hand and the world Polar bear my favorite.the others are too many charts to concentrate on. The global temp chart is easy to follow.,1,47,4.26,0
667,R_75sct7Sgld5oP4e,High,the content of these pictures is Earth and the environment and are trying to convey that we are killing our planet.,Earth and the environment. They are colorful and are meant to invoke sadness that we are killing our planet.,text,the content of these pictures is Earth and the environment and are trying to convey that we are killing our planet. Earth and the environment. They are colorful and are meant to invoke sadness that we are killing our planet.,1,40,10,2.5
668,R_6FCUjOLWP9Vf3ck,Low,These images include people. Some of them are in city settings. The pictures of protests make me feel interested.,These pictures represent the global issue of climate change. They make me feel interested in learning more.,text,These images include people. Some of them are in city settings. The pictures of protests make me feel interested. These pictures represent the global issue of climate change. They make me feel interested in learning more.,1,36,5.56,0
669,R_52DpDvz2a3DkGEV,High,They make me feel like I’m capable of anything. The pictures are of earth and the most beautiful parts of it.,"It represents two opposites, Fire and Water. It makes me feel like I’m ready to take on the world immediately.",text,"They make me feel like I’m capable of anything. The pictures are of earth and the most beautiful parts of it. It represents two opposites, Fire and Water. It makes me feel like I’m ready to take on the world immediately.",1,41,2.44,0
670,R_6OUPK8C4JCVHhW2,Low,It’s looks like a bunch of jumbled news stories. To be honest I feel like it’s propaganda to get me to think a certain way. It also is not peaceful so I feel they are trying to invoke a state of fear.,"Confused on content, there’s no context I can see so I’m left with unanswered questions. It looks like they are trying to show data on reasearch and be official but to me it looks jumbled and doesn’t give a whole picture for me to judge.",text,"It’s looks like a bunch of jumbled news stories. To be honest I feel like it’s propaganda to get me to think a certain way. It also is not peaceful so I feel they are trying to invoke a state of fear.  Confused on content, there’s no context I can see so I’m left with unanswered questions. It looks like they are trying to show data on reasearch and be official but to me it looks jumbled and doesn’t give a whole picture for me to judge.",1,87,3.45,2.3
671,R_1P4TrNS96Tg1kNv,High,This are images of the planet that needs our help to survive. Climate change needs to be addresses as quick as possible.,"This are images of our planet Earth, most images illustrate the Earth suffering from climate change.",text,"This are images of the planet that needs our help to survive. Climate change needs to be addresses as quick as possible. This are images of our planet Earth, most images illustrate the Earth suffering from climate change.",1,38,5.26,2.63
672,R_1QLVfy8wTeepVAZ,High,These images are very beautiful. The colors are very vibrant. I would be pleased to see these come up in a search result.,The content appears to involve human hands and the earth. The colors are very vibrant. I would be pleased to see these results.,text,These images are very beautiful. The colors are very vibrant. I would be pleased to see these come up in a search result. The content appears to involve human hands and the earth. The colors are very vibrant. I would be pleased to see these results.,1,46,6.52,4.35
673,R_7CKOcJ3HfGgi1RT,Low,It shows Different place around the world amusement park gathering different cultures people having,To me it looks like they showing you and telling you about history and it makes me feel good to see things like that happening as well,text,It shows Different place around the world amusement park gathering different cultures people having  To me it looks like they showing you and telling you about history and it makes me feel good to see things like that happening as well,1,41,7.32,4.88
674,R_5oRr59ASTNZNXVd,High,It shows the effects of climate change on Earth. It shows what it can look like either with climate change being affected and without.,The effects of climate change and astronomical events. They show that the Earth could be nice and habitable and it also shows that it can be destroyed.,text,It shows the effects of climate change on Earth. It shows what it can look like either with climate change being affected and without. The effects of climate change and astronomical events. They show that the Earth could be nice and habitable and it also shows that it can be destroyed.,1,51,3.92,0
675,R_1WIIRyp3kXC1MHu,Low,"I am seeing images of different people's in what seem to be a news station broadcasting  live events ,",I am seeing different picture of the world with a child in it and it make me feel relaxing  and comfortable,text,"I am seeing images of different people's in what seem to be a news station broadcasting  live events ,  I am seeing different picture of the world with a child in it and it make me feel relaxing  and comfortable",1,39,5.13,5.13
676,R_3ojGMJbjQaZr3y1,High,Environmental images of planet Earth. Like environmental images but not pollution stacks but know manufacturing is essential part of life.,Wide variety of environmental images. Some images show 2 sides of good and bad for earth which is reality of life.,text,Environmental images of planet Earth. Like environmental images but not pollution stacks but know manufacturing is essential part of life. Wide variety of environmental images. Some images show 2 sides of good and bad for earth which is reality of life.,1,41,4.88,4.88
677,R_1g1rMluyROHHViv,High,"The orange makes me think of dry surroundings,  like a desert. I think of thirst and heat and the search for water","They have a lot of orange, making me think of fire and heat. I think of destruction and fire and being hot.",text,"The orange makes me think of dry surroundings,  like a desert. I think of thirst and heat and the search for water They have a lot of orange, making me think of fire and heat. I think of destruction and fire and being hot.",1,44,2.27,0
678,R_7exxZTEeTFNnBvl,High,Like opposites together in one picture destruction and nature all in one not sure how else to describe it,These are images of the earth shown from different perspectives artisticly on each picture shown idk what else to say,text,Like opposites together in one picture destruction and nature all in one not sure how else to describe it These are images of the earth shown from different perspectives artisticly on each picture shown idk what else to say,1,39,2.56,0
679,R_6kBZkXDHfwmOj8F,Low,I’m not sure what I am supposed to feel by looking at these pictures.  Some of them are attractive while others I don’t understand,Shocking. The most influential one is the temperature chart. We need to change to protect our world.,text,I’m not sure what I am supposed to feel by looking at these pictures.  Some of them are attractive while others I don’t understand  Shocking. The most influential one is the temperature chart. We need to change to protect our world.,1,41,4.88,2.44
680,R_7tlKMwnNSHXzx2J,High,Some are good and some show pollution. Need to stop polluting and turn green. Shut down the factories,"Climate change is happening, the earth is getting hotter and the icebergs are melting. Need to do something about it now.",text,"Some are good and some show pollution. Need to stop polluting and turn green. Shut down the factories Climate change is happening, the earth is getting hotter and the icebergs are melting. Need to do something about it now.",1,39,2.56,2.56
681,R_7qlY3iBnNOQeTWs,High,"They make me scared. They remind me of the Apocalypse. They look dry and eerie. They also show some new life after the devastation, which gives me some hope.",We need to take better care of our planet. They make me think of how the climate is changing and how it's hurting wildlife.,text,"They make me scared. They remind me of the Apocalypse. They look dry and eerie. They also show some new life after the devastation, which gives me some hope.  We need to take better care of our planet. They make me think of how the climate is changing and how it's hurting wildlife.",1,53,13.21,7.55
682,R_3ex4RE2Nzv4IiRz,High,"I feel despair and fear, worried what earth will look like in 5 years, in 10. The earth is dying and we need to help it.","They make me feel scared for what is happening to the planet, it is dying. It makes me feel worried about the future.",text,"I feel despair and fear, worried what earth will look like in 5 years, in 10. The earth is dying and we need to help it.  They make me feel scared for what is happening to the planet, it is dying. It makes me feel worried about the future.",1,49,12.24,10.2
683,R_3EasvzgkmZDEwyB,Low,Makes me feel hopeful for uniting together. Gives a sense of world peace. The protests are concerning but it is apart of sticking together for a great cause.,"The colors give a feel that the story is about the earth, hence the blue and green. I see charts that show what I believe are temperatures either rising or falling over a give time.",text,"Makes me feel hopeful for uniting together. Gives a sense of world peace. The protests are concerning but it is apart of sticking together for a great cause. The colors give a feel that the story is about the earth, hence the blue and green. I see charts that show what I believe are temperatures either rising or falling over a give time.",1,63,4.76,1.59
684,R_1P5i2pcjK45EBeU,High,"The pictures show the causes (smoke stacks and pollution) and impacts of climate change and global warming (cracked earth, less vegetation, polluted water). They make me feel sad.","The pictures show the impact of rising temperatures on the land,  the vegetation, animals and the world. It makes me sad and angry.",text,"The pictures show the causes (smoke stacks and pollution) and impacts of climate change and global warming (cracked earth, less vegetation, polluted water). They make me feel sad. The pictures show the impact of rising temperatures on the land,  the vegetation, animals and the world. It makes me sad and angry.",1,51,5.88,5.88
685,R_6CaoUnXLAfq9uVu,High,THE FIRST IMAGE IS THAT OF SCORCHED EARTH CAUSED BY ALL OF THE POLLUTION FROM FACTORIES. IT MAKES ME FEEL SAD FOR OUR PLANET. THE SECOND IMAGE IS THAT OF A DRIED UP LAKE. IT MAKES ME SAD FOR THE AQUATIC LIFE THAT HAS DIED. THE THIRD IMAGE IS SHOWING THAT WE HOLD WHAT HAPPENS TO OUR PLANET IN THE PALM OF OUR HANDS. IT GIVES ME HOPE. THE NEXT TWO IMAGES ARE OF THE POLLUTION CAUSED BY FACTORIES. THEY MAKE ME FEEL SAD FOR OUR PLANET. THE NEXT IMAGE IS THAT OF WHAT COULD HAPPEN TO HALF OF OUR PLANET IF WE DO NOT CHANGE OUR WAYS ABOUT POLLUTION. IT MAKES ME FEEL CONCERNED. THE NEXT IMAGE IS THAT OF NEW LIFE GROWING IN A LIGHT BULB. IT SEEMS TO REPRESENT THAT NEW LIFE CAN COME FROM NEW IDEAS. I FEEL HOPEFUL. THE NEXT IMAGE IS THAT OF NATURE TOUCHING SCORCHED EARTH. IT GIVES ME HOPE. THE NEXT IMAGE SHOWS A KANGAROO HAVING TO SURVIVE IN THE MIDST OF FACTORY POLLUTION. IT MAKES ME SAD. THE FINAL IMAGE SHOWS A LEAF WITH THE LEFT SIDE BURNED AMIDST SCORCHED EARTH AND THE RIGHT SIDE THRIVING AMIDST A POLLUTION FREE EARTH. IT GIVES ME HOPE THAT WE CAN TURN THINGS AROUND.,THEY ALL SHOW DIFFERENT VARIATIONS OF HOW POLLUTION IS DESTROYING OUR PLANET AND THAT WE AS PEOPLE HOLD THE WORLD IN OUR HANDS AND CAN CHANGE THINGS FOR THE BETTER.,text,THE FIRST IMAGE IS THAT OF SCORCHED EARTH CAUSED BY ALL OF THE POLLUTION FROM FACTORIES. IT MAKES ME FEEL SAD FOR OUR PLANET. THE SECOND IMAGE IS THAT OF A DRIED UP LAKE. IT MAKES ME SAD FOR THE AQUATIC LIFE THAT HAS DIED. THE THIRD IMAGE IS SHOWING THAT WE HOLD WHAT HAPPENS TO OUR PLANET IN THE PALM OF OUR HANDS. IT GIVES ME HOPE. THE NEXT TWO IMAGES ARE OF THE POLLUTION CAUSED BY FACTORIES. THEY MAKE ME FEEL SAD FOR OUR PLANET. THE NEXT IMAGE IS THAT OF WHAT COULD HAPPEN TO HALF OF OUR PLANET IF WE DO NOT CHANGE OUR WAYS ABOUT POLLUTION. IT MAKES ME FEEL CONCERNED. THE NEXT IMAGE IS THAT OF NEW LIFE GROWING IN A LIGHT BULB. IT SEEMS TO REPRESENT THAT NEW LIFE CAN COME FROM NEW IDEAS. I FEEL HOPEFUL. THE NEXT IMAGE IS THAT OF NATURE TOUCHING SCORCHED EARTH. IT GIVES ME HOPE. THE NEXT IMAGE SHOWS A KANGAROO HAVING TO SURVIVE IN THE MIDST OF FACTORY POLLUTION. IT MAKES ME SAD. THE FINAL IMAGE SHOWS A LEAF WITH THE LEFT SIDE BURNED AMIDST SCORCHED EARTH AND THE RIGHT SIDE THRIVING AMIDST A POLLUTION FREE EARTH. IT GIVES ME HOPE THAT WE CAN TURN THINGS AROUND. THEY ALL SHOW DIFFERENT VARIATIONS OF HOW POLLUTION IS DESTROYING OUR PLANET AND THAT WE AS PEOPLE HOLD THE WORLD IN OUR HANDS AND CAN CHANGE THINGS FOR THE BETTER.,1,240,6.67,3.75
686,R_7psc5FHeETCkgD4,High,"These photos depot change, moving from one gilded dimension to a bright one; they speak of possibilities in a change of perspective","Photos of the earth that have been enhanced.  They add excitement, vision, inspiration to the mind.",text,"These photos depot change, moving from one gilded dimension to a bright one; they speak of possibilities in a change of perspective  Photos of the earth that have been enhanced.  They add excitement, vision, inspiration to the mind.",1,38,10.53,5.26
687,R_5a8tyD7ilDj54NH,Low,The world is what I see I think it's about everyone in the world so there's man screens for everything,It shoes maps an different parts if the world an different places where other people live.,text,The world is what I see I think it's about everyone in the world so there's man screens for everything It shoes maps an different parts if the world an different places where other people live.,1,36,0,0
688,R_12tYX6kRZXZS0MY,Low,Earthy with all the greens and blues and i am not sure what else I don’t know why you have to type out 100 words here,"I like the colors so they make me feel calm and collected and happy I guess I’m just typing more
so this goes away",text,"Earthy with all the greens and blues and i am not sure what else I don’t know why you have to type out 100 words here  I like the colors so they make me feel calm and collected and happy I guess I’m just typing more
so this goes away",1,50,4,4
689,R_3gOQbxM8b1GrHJV,Low,That women are voicing their opinions of what's happening in the world now of all ages.women have come a long ways,Sad that the worlds climate has changed so much for the bad and endangering the polor bears habitat,text,That women are voicing their opinions of what's happening in the world now of all ages.women have come a long ways Sad that the worlds climate has changed so much for the bad and endangering the polor bears habitat,1,40,5,5
690,R_6QzZ6eW68vYErzo,Low,"I see a small world, with unpopular images (voting for the elderly, a red haired women, a rally, etc.), The images give a sense of sadness, loneliness, and being overwhelmed.","Images depict global warming and its effects on the planet, and the people and animals within it. It’s a sad and scary reality.",text,"I see a small world, with unpopular images (voting for the elderly, a red haired women, a rally, etc.), The images give a sense of sadness, loneliness, and being overwhelmed.  Images depict global warming and its effects on the planet, and the people and animals within it. It’s a sad and scary reality.",1,53,9.43,9.43
691,R_1nRdVlgOw640t2h,High,Makes me think of the different places in the world that look like those images. I think of Egypt cause of the desert picture,Makes me think of heaven and hell specifically because of the two side by side images of earth normal and earth on fire.,text,Makes me think of the different places in the world that look like those images. I think of Egypt cause of the desert picture Makes me think of heaven and hell specifically because of the two side by side images of earth normal and earth on fire.,1,47,4.26,0
692,R_18H4TEVxcN24Ak0,Low,"Photos of various things on earth. Buildings, people, etc. the earth is small and we are on it together.",Pictures of earth and its inhabitants. Along with a chart of global warming . It also shows signs of pollution.,text,"Photos of various things on earth. Buildings, people, etc. the earth is small and we are on it together.  Pictures of earth and its inhabitants. Along with a chart of global warming . It also shows signs of pollution.",1,38,0,0
693,R_19swi5wHfHivgOt,High,Makes me feel like Pollutions is killing everything in the world and we have little time to turn things around,To me it make me look at the world and its pollutions of the manufactioning has on the as a whole world and in packs us all,text,Makes me feel like Pollutions is killing everything in the world and we have little time to turn things around To me it make me look at the world and its pollutions of the manufactioning has on the as a whole world and in packs us all,1,47,2.13,0
694,R_18huc3VthgLApzj,Low,"It look like all of these images are showing progress that people are making in the fight against warming and climate change. It's good, but definitely not good enough.",Hopeless and sad. I feel like humans are failing our planet and our future. The polar bear image really makes me sad because it isn't the animal's fault at all.,text,"It look like all of these images are showing progress that people are making in the fight against warming and climate change. It's good, but definitely not good enough. Hopeless and sad. I feel like humans are failing our planet and our future. The polar bear image really makes me sad because it isn't the animal's fault at all.",1,59,11.86,8.47
