"",ResponseId,condition,open.1,open.2,ColumnID,Text,Segment,WC,Affect,emotion
461,R_5k0lIPnzQ5bQtqE,High,"Looks like they're directed more towards nature water, colors don't seem to be as bright as previous......some of them I like and others aren't crazy about or neutral","Alot of warm bright colors, could be paintings, pictures hard to say, they give me a good feeling about them",text,"Looks like they're directed more towards nature water, colors don't seem to be as bright as previous......some of them I like and others aren't crazy about or neutral Alot of warm bright colors, could be paintings, pictures hard to say, they give me a good feeling about them",1,49,8.16,4.08
462,R_3XTyJeHJYxBi6u5,Low,The pictures are compelling and easy to absorb. The Text is still not readable to me except in the photos.,"The images are familiar. However I am unable to read the text. I think it is Russian, but not sure. It makes me confused",text,"The pictures are compelling and easy to absorb. The Text is still not readable to me except in the photos. The images are familiar. However I am unable to read the text. I think it is Russian, but not sure. It makes me confused",1,44,4.55,2.27
463,R_1kNVHUzY4p98VwS,High,Just crazy pictures that really didn't happen to mean that much to me when I was hungry for the future and that,"It looks great. I t. inks it is Disney characters 
 Disney characters we are my favorite holiday season and the cost of thrones is very expensive for us to afford on a regular basis  it will probably hurt",text,"Just crazy pictures that really didn't happen to mean that much to me when I was hungry for the future and that   It looks great. I t. inks it is Disney characters 
 Disney characters we are my favorite holiday season and the cost of thrones is very expensive for us to afford on a regular basis  it will probably hurt",1,60,10,3.33
464,R_7jrKUD5twgwOxxf,High,To me these pictures are not telling me the truth about climate change. They show fossil fuels and CO2 as the big problem. That is not consistent with data. The earth goes through warm and cold cycles and has for millions of years. Man is not causing the problem.,"They are all but one are meant to make sure you know about climate change, and they picture it as devastating.",text,"To me these pictures are not telling me the truth about climate change. They show fossil fuels and CO2 as the big problem. That is not consistent with data. The earth goes through warm and cold cycles and has for millions of years. Man is not causing the problem. They are all but one are meant to make sure you know about climate change, and they picture it as devastating.",1,70,0,0
465,R_6qC4IxYEKoyVqas,Low,"Well i would somewhat different feelings on each. Pollution i feel concerned. Protests hard to tell what is being protested, but i would like to find out more. The image of the field with trees, take from the perspective of a ""birds eye"" view made me smile. One image of the rainbow, reminded me of the LGBTQ+ community, kind of made me sad. A couple i couldn't figure out.","Most of these images, to me, look like the point is trying to come across is over population. Along with the consequences. Which, to me, is way overstated, the earth is not even close to being overpopulated.",text,"Well i would somewhat different feelings on each. Pollution i feel concerned. Protests hard to tell what is being protested, but i would like to find out more. The image of the field with trees, take from the perspective of a ""birds eye"" view made me smile. One image of the rainbow, reminded me of the LGBTQ+ community, kind of made me sad. A couple i couldn't figure out. Most of these images, to me, look like the point is trying to come across is over population. Along with the consequences. Which, to me, is way overstated, the earth is not even close to being overpopulated.",1,106,8.49,4.72
466,R_5NJS4ABEEt8EYRr,High,All show destroing The World.all what is happening to The World affect ale od us so all of us need and asking for help,After all what happen to The World There is always hope to start a new life.It makes me to feel happy that with our help the new life will be better,text,All show destroing The World.all what is happening to The World affect ale od us so all of us need and asking for help  After all what happen to The World There is always hope to start a new life.It makes me to feel happy that with our help the new life will be better,1,57,14.04,3.51
467,R_129cT4IWN2gPJ52,High,These pictures mostly show pollution and how it is destroying the earth makes me feel sad but this is reality,"Many pictures of the earth and places on earth and polar gears and some sun sets, deserts, pollution",text,"These pictures mostly show pollution and how it is destroying the earth makes me feel sad but this is reality Many pictures of the earth and places on earth and polar gears and some sun sets, deserts, pollution",1,38,5.26,2.63
468,R_3TKSAl2dVFHLmle,High,parched land  the world hot and perfect  trash  animals escaping forest fires plants with too little moisture,living on this earth and holding the world in your hand there are many changes in the terrain The world is daylight on one side and dark on the other habitat of some animals are being destroyed we are using solar energy our ice caps are melting  we have some beautiful green spaces and those deprived of water,text,parched land  the world hot and perfect  trash  animals escaping forest fires plants with too little moisture living on this earth and holding the world in your hand there are many changes in the terrain The world is daylight on one side and dark on the other habitat of some animals are being destroyed we are using solar energy our ice caps are melting  we have some beautiful green spaces and those deprived of water,1,75,5.33,0
469,R_2MQbXvOvBt0omVW,High,"Industrial polutions with emphasis on smoke on planet earth, dry earth, therefor nothing appealing on this planef.","Planet earth from many different times, seasons, angles and locations and temperatures, even icebears.",text,"Industrial polutions with emphasis on smoke on planet earth, dry earth, therefor nothing appealing on this planef. Planet earth from many different times, seasons, angles and locations and temperatures, even icebears.",1,31,3.23,0
470,R_7dAoR5XzTPtWAhg,Low,"They are a hodge podge of images which seem to have little or no connection to each other.  It looks like some have to do with air pollution, global warming, immigration, possibly LBGT rights, I really am not sure.  They make me feel confused about what point they are trying make.",All these images seem to reference global warming from different areas in the world.  They make me feel very concerned and very sad.  I worry about what we are leaving behind for my grand children and great grand children.  My mother would say we are going to hell in a hand basket.  I feel the same.,text,"They are a hodge podge of images which seem to have little or no connection to each other.  It looks like some have to do with air pollution, global warming, immigration, possibly LBGT rights, I really am not sure.  They make me feel confused about what point they are trying make.  All these images seem to reference global warming from different areas in the world.  They make me feel very concerned and very sad.  I worry about what we are leaving behind for my grand children and great grand children.  My mother would say we are going to hell in a hand basket.  I feel the same.",1,107,7.48,3.74
471,R_6CtnvrFXMaRgr05,Low,It looks like lots of people working together to help make a difference and to turn climate change around. It makes me feel hopeful.,Scared of what humans are doing to our world... only home we have. I can't read most of the verbage but I feel that I can have hope we can turn things around.,text,"It looks like lots of people working together to help make a difference and to turn climate change around. It makes me feel hopeful.
 Scared of what humans are doing to our world... only home we have. I can't read most of the verbage but I feel that I can have hope we can turn things around.",1,57,10.53,5.26
472,R_61ZUfESA7l2xdw7,High,"The collection of images are of planet Earth and what look to be results of disaster or climate change, such as erosion, fire damage, a leave that is half green with the other half burning away in ashes etc. If anything, the only emotion zi really feel is curiosity, as to what was searched to bring similar Earth images with such eclectic differences between all of them.","These seem to be all images relating to climate change; specifically, the change/rise in overall temperatures and others making reference to the Earth ""burning."" These images make me feel frustrated and angry, because I don't believe in thr climate change thag politicians and environmentalists are trying to sell to the greater American public, in turn to fuel their green/eco-friendly agendas.",text,"The collection of images are of planet Earth and what look to be results of disaster or climate change, such as erosion, fire damage, a leave that is half green with the other half burning away in ashes etc. If anything, the only emotion zi really feel is curiosity, as to what was searched to bring similar Earth images with such eclectic differences between all of them. These seem to be all images relating to climate change; specifically, the change/rise in overall temperatures and others making reference to the Earth ""burning."" These images make me feel frustrated and angry, because I don't believe in thr climate change thag politicians and environmentalists are trying to sell to the greater American public, in turn to fuel their green/eco-friendly agendas.",1,129,2.33,2.33
473,R_1kaFig2RtiNhrXz,Low,Protests and Earth which are polarizing to me and make me feel a weird type of way so I’m eager to know what it is,Maps and statistical charts and historical maps which might be correlated to global warming in some way,text,Protests and Earth which are polarizing to me and make me feel a weird type of way so I’m eager to know what it is Maps and statistical charts and historical maps which might be correlated to global warming in some way,1,42,2.38,0
474,R_3OkIqOTHgz61GzS,High,Same as the other batch. What are these beautiful pictures for.  Pictures like this should be displayed or even sold.,Some are really pretty and some are hard to understand.  I collect pictures for my screen saver.  I have over 200 to display.,text,Same as the other batch. What are these beautiful pictures for.  Pictures like this should be displayed or even sold. Some are really pretty and some are hard to understand.  I collect pictures for my screen saver.  I have over 200 to display.,1,43,2.33,0
475,R_5M5L02PSlGz1nEw,High,GOD has blessed Man with this planet and Man is abusing the planet for profit regardless of the consequences,"The Earth Climate is in trouble... Fires, Air Pollution. I feel VERY concerned on the direction man is currently headed if something not done soon to slow down OR Stop the damage.",text,"GOD has blessed Man with this planet and Man is abusing the planet for profit regardless of the consequences The Earth Climate is in trouble... Fires, Air Pollution. I feel VERY concerned on the direction man is currently headed if something not done soon to slow down OR Stop the damage.",1,51,7.84,1.96
476,R_50ZzPI4FtE7VjiH,Low,Every one has a voice and should be able to use to get there point of view across with out fear.Not every idea appeals to allof us,Our world. We are all on one planet and that it is getting warmer and will affect us all.Everyone need to take personal responsibility anddo all they can to make this a safe earth for all.,text,Every one has a voice and should be able to use to get there point of view across with out fear.Not every idea appeals to allof us Our world. We are all on one planet and that it is getting warmer and will affect us all.Everyone need to take personal responsibility anddo all they can to make this a safe earth for all.,1,65,3.08,1.54
477,R_7elyfYQsEkY9wml,Low,The pictures look like they depict many different things. I have no idea what the central theme of the whole idea really is.,Not sure what they are depicting since everything is in a foreign language. Maybe something to do with climate change,text,The pictures look like they depict many different things. I have no idea what the central theme of the whole idea really is. Not sure what they are depicting since everything is in a foreign language. Maybe something to do with climate change,1,43,0,0
478,R_1DMU5xwkhfQdMJQ,Low,These pictures could be of anything.  The only one that really captures my attention is the smoke billowing from the factory or whatever it is.  That one is a bit disturbing.  The others are just random photos with no real meaning to me.,two of the photos are concerning to me.  the poor polar bear on the melting ice and the graph of the global temperature change presents a real problem in my opinion.,text,These pictures could be of anything.  The only one that really captures my attention is the smoke billowing from the factory or whatever it is.  That one is a bit disturbing.  The others are just random photos with no real meaning to me. two of the photos are concerning to me.  the poor polar bear on the melting ice and the graph of the global temperature change presents a real problem in my opinion.,1,74,2.7,0
479,R_1aVPdTVUKsjfQFV,Low,There is not enough information in these images to have any type of a reaction. They do not show much of anything for anything in particular.  No feelings towards them.,No feelings in these pictures that are too vague to represent much of anything. Not enough information shown.,text,There is not enough information in these images to have any type of a reaction. They do not show much of anything for anything in particular.  No feelings towards them.  No feelings in these pictures that are too vague to represent much of anything. Not enough information shown.,1,48,0,0
480,R_1K23u1dNBlk5o3j,High,The images are of different landscapes. They are all interesting!  They make me want to look at them all more carefully.,These images appear to be showing the effects climate has on regions of earth. They are not as appealing to me as the first ones were.,text,The images are of different landscapes. They are all interesting!  They make me want to look at them all more carefully.  These images appear to be showing the effects climate has on regions of earth. They are not as appealing to me as the first ones were.,1,47,4.26,0
481,R_6Pwm2ZX05ws9U6e,Low,"Pictures with environmental themes, some are photos and some are are photos of demonstrations and ordinary people.","Various graphs and photos of nature and people. Some of the text appears to be in Russian, some in English.",text,"Pictures with environmental themes, some are photos and some are are photos of demonstrations and ordinary people. Various graphs and photos of nature and people. Some of the text appears to be in Russian, some in English.",1,37,0,0
482,R_6tlhPFI03x5cZVL,High,"they are very vibrant and colorful, and make me feel excited because nature is really so beautiful, isn’t it?","holding the earth in our hands is quite an interesting image, and do we really hold the earth in our hands?",text,"they are very vibrant and colorful, and make me feel excited because nature is really so beautiful, isn’t it? holding the earth in our hands is quite an interesting image, and do we really hold the earth in our hands?",1,40,10,2.5
483,R_6EX1ujro37MUfkw,Low,"I'm mostly perplexed because I don't have any context for the images or there are signs written in a language I don't understand. The one image that I can understand makes me think wow senior citizens demonstrating to help save us really because personally I feel the planet will be fine, but if anything isn't,  it'll be us.",I only really understood-----or think I do the image of the earth that's green on one side and gray on the other and the polar bear on a small flotilla of ice and they just made me think that's not good,text,"I'm mostly perplexed because I don't have any context for the images or there are signs written in a language I don't understand. The one image that I can understand makes me think wow senior citizens demonstrating to help save us really because personally I feel the planet will be fine, but if anything isn't,  it'll be us. I only really understood-----or think I do the image of the earth that's green on one side and gray on the other and the polar bear on a small flotilla of ice and they just made me think that's not good",1,100,6,2
484,R_5R3UJ6jUAN80BDE,Low,"a variety of different people and places that didnt make me feel anything.There were people protesting , a crystal ball, graphs, polution,
.","There was a globe, polar bear  standing on an iceburg, maps, graphs, an asian lady with her arm up in the air and I didnt feel anything",text,"a variety of different people and places that didnt make me feel anything.There were people protesting , a crystal ball, graphs, polution,
. There was a globe, polar bear  standing on an iceburg, maps, graphs, an asian lady with her arm up in the air and I didnt feel anything",1,49,0,0
485,R_1jMfMCK5bOGqZQB,High,The images causes me to think about global warming and the unseasonal weather we've been experiencing lately. The images also seem as a call to arms for environmentalists.,The images cause concern for the condition of this planet. It emphasizes the need to protect the planet.,text,The images causes me to think about global warming and the unseasonal weather we've been experiencing lately. The images also seem as a call to arms for environmentalists.  The images cause concern for the condition of this planet. It emphasizes the need to protect the planet.,1,46,0,0
486,R_7OPNZ7N7ksyAibo,Low,Some images may be interconnected and other appear to be random images. I feel neutral without knowing any further context.,Appears they all related to climate change. They make me feel like I want to know more about what they are intended to convey.,text,Some images may be interconnected and other appear to be random images. I feel neutral without knowing any further context. Appears they all related to climate change. They make me feel like I want to know more about what they are intended to convey.,1,44,0,0
487,R_1Br1B5PWSRdgbDQ,High,Different was the climate is changing which is alarming and some changes are needed to possibly make it better,Climate changes which I am fearful we cannot reverse but if everyone does their part we can make a difference,text,Different was the climate is changing which is alarming and some changes are needed to possibly make it better  Climate changes which I am fearful we cannot reverse but if everyone does their part we can make a difference,1,39,7.69,5.13
488,R_3rC9bNgJGW3VDZJ,Low,A seemingly random series of images that leaves me a bit confused. I don't really know what to make of them.,"There were two identical images, one image depicting an overcrowded planet and another overdone image depicting a mere one degree Celsius global average temperature increase since 1880 (140+ years).",text,"A seemingly random series of images that leaves me a bit confused. I don't really know what to make of them. There were two identical images, one image depicting an overcrowded planet and another overdone image depicting a mere one degree Celsius global average temperature increase since 1880 (140+ years).",1,50,4,2
489,R_70q4jv9GX8rAwrQ,High,Views of our world. How fragile and delicate the balance is. How nature responds to what we are doing to the earth.,Global warming. Devastated earth/nature. Our misusing of the resources that the earth gives and we destroy.,text,Views of our world. How fragile and delicate the balance is. How nature responds to what we are doing to the earth. Global warming. Devastated earth/nature. Our misusing of the resources that the earth gives and we destroy.,1,39,5.13,0
490,R_338GOqA2LvwcGWE,High,Environmental images raising concerns about what may be happening to our planet and its environment.,The images appear to be directed toward environmental issues or content. As such they present concerns of what is happening or what we are doing to our global environment.,text,Environmental images raising concerns about what may be happening to our planet and its environment. The images appear to be directed toward environmental issues or content. As such they present concerns of what is happening or what we are doing to our global environment.,1,44,0,0
491,R_6964bCTGobmo9DY,Low,It seems to me that there are protests going on but once again I'm kind of confused about what I'm looking at,They make me feel confused because I don't know what I am looking at in this picture I'm being shown,text,It seems to me that there are protests going on but once again I'm kind of confused about what I'm looking at They make me feel confused because I don't know what I am looking at in this picture I'm being shown,1,42,4.76,4.76
492,R_1eFslPCuVyIE0k4,Low,These images mainly show people in various situations. I like this set of images more because I could write a story based on each of these images.,"Diverse images of pictures, graphs, diagrams, and AI constructs. These images make me feel bored. The only image that I really like is the image of the polar bear on the ice floe.",text,"These images mainly show people in various situations. I like this set of images more because I could write a story based on each of these images. Diverse images of pictures, graphs, diagrams, and AI constructs. These images make me feel bored. The only image that I really like is the image of the polar bear on the ice floe.",1,60,1.67,1.67
493,R_5YYC58hATRget8f,Low,Basically I  perceive  pollution  and cleaning up the environment is the general message...apparently  we need to stop polluting the air and go green. Start growing  plant based everything.,I get the jest that our earth  is getting  warmer. The ice Bergs's are melting   away and the climate will soon be too hot for  creatures of the Arctic...polar bears and  creatures who live in frigid climates...,text,Basically I  perceive  pollution  and cleaning up the environment is the general message...apparently  we need to stop polluting the air and go green. Start growing  plant based everything.  I get the jest that our earth  is getting  warmer. The ice Bergs's are melting   away and the climate will soon be too hot for  creatures of the Arctic...polar bears and  creatures who live in frigid climates...,1,67,1.49,0
494,R_6q3Z3JlbFv3wBeY,High,Very afraid of what the future holds due to the lack of valid conversations regarding our environment and specifically climate change.,The content of these images are showing images of what climate change is doing to our world now and what is projected in the future if nothing is done about it.,text,Very afraid of what the future holds due to the lack of valid conversations regarding our environment and specifically climate change. The content of these images are showing images of what climate change is doing to our world now and what is projected in the future if nothing is done about it.,1,52,1.92,1.92
495,R_3GCFATt3cprYUfe,Low,I am confused by theaae images and don;t know what all this is.  It is global.  My gyess is it has something to do with the enviornment and global warming.,Indifferent. It doesen’t do anything for me.  This is something gloobal with sttistics.   Whatver it is for statistics show the rise on the grff.,text,I am confused by theaae images and don;t know what all this is.  It is global.  My gyess is it has something to do with the enviornment and global warming. Indifferent. It doesen’t do anything for me.  This is something gloobal with sttistics.   Whatver it is for statistics show the rise on the grff.,1,55,3.64,3.64
496,R_3OZ5PaKxqRuYLim,High,"These pictures describe the influence that fossil fuels have on global warming, as well as the effect of gases, electric lights and other items are affecting the world.",It is about the world and the environment and depicts the influence of global warming. It shows that the world is suffering.,text,"These pictures describe the influence that fossil fuels have on global warming, as well as the effect of gases, electric lights and other items are affecting the world. It is about the world and the environment and depicts the influence of global warming. It shows that the world is suffering.",1,50,4,2
497,R_7nBnk5yk8CzFDfM,High,THESE PHOTOS MAKE ME FEEL SAD DUE TO ALL THE PHOTOS SHOWING POLLUTION BEING RELEASED INTO THE AIR CAUSING OZONE DEPLEATION WHICH CAN CAUSE THE EARTH TEMPERATURE TO RISE .,SEVERAL OF THESE PICTURES SHOW INDUSTRIAL POLUTION THAT IS BEING RELEASED INTO THE ATMOSPHEAR. THIS INTERN CAN DEPLEAT THE OZONE LAYER CAUSE CHANGES IN WEATHER OR THE TEMPERATURE ON EARTH. IN SEVERAL PICTURES YOU CAN SEE THE GOOD SIDE OF THINGS GROWNING ON EARTH AND THE OTHER SIDE OF THE SAME PICTURE THE BAD SIDE OF THINGS AFTER THE DEPLEATING OF THE OZONE LAYER.,text,THESE PHOTOS MAKE ME FEEL SAD DUE TO ALL THE PHOTOS SHOWING POLLUTION BEING RELEASED INTO THE AIR CAUSING OZONE DEPLEATION WHICH CAN CAUSE THE EARTH TEMPERATURE TO RISE . SEVERAL OF THESE PICTURES SHOW INDUSTRIAL POLUTION THAT IS BEING RELEASED INTO THE ATMOSPHEAR. THIS INTERN CAN DEPLEAT THE OZONE LAYER CAUSE CHANGES IN WEATHER OR THE TEMPERATURE ON EARTH. IN SEVERAL PICTURES YOU CAN SEE THE GOOD SIDE OF THINGS GROWNING ON EARTH AND THE OTHER SIDE OF THE SAME PICTURE THE BAD SIDE OF THINGS AFTER THE DEPLEATING OF THE OZONE LAYER.,1,93,3.23,3.23
